{"artifact_type":"agent-evidence-comparison-manifest","boundary":"Agent-authored reference answers and review criteria are frozen before target-model inference. They are not independent human gold and are never sent to the model.","budget":{"context_window":8192,"max_model_calls":1,"max_observation_chars":20000,"max_output_tokens_per_call":512,"max_seconds":120.0,"max_steps":3,"max_tool_calls":2,"max_total_tokens":6000},"cases":[{"bundle_sha256":"68134b833e26e93825a6cd7d8eaf4faf9446f3dfa3ccc609ffcc0071a3622ff2","case_id":"blocked-checks-handoff","category":"project-only-handoff","criteria":[{"criterion_id":"both-status-reasons","description":"分别准确写出 impact=blocked/snapshots_not_comparable 与 policy.TASK_REF=blocked/ambiguous_target。"},{"criterion_id":"evidence-limit","description":"只把状态和原因归于 Workbench 报告，不推断 DaVinci、硬件或具体根因。"},{"criterion_id":"bounded-next-step","description":"后续动作限定为补齐唯一目标和可比较快照后重跑检查。"}],"plan":{"artifact_type":"agent-evidence-plan","boundary":"The control plane selects a fixed sequence of registered read tools. The model cannot add, remove, reorder, or parameterize those calls.","goal":"给接手该项目的工程师写一段简短交接：分别说明 impact 与 policy.TASK_REF 当前记录的状态和原因，这些记录足以得出什么结论、还不能得出什么结论。只用项目证据，不检索外部资料。","plan_id":"288945128159cc75f0459c73957637b825c6a72265e14d6452e8aa2b6af1387f","schema_version":"agent-evidence-plan-0.1","scope":"project_detail","steps":[{"arguments":{"question":"给接手该项目的工程师写一段简短交接：分别说明 impact 与 policy.TASK_REF 当前记录的状态和原因，这些记录足以得出什么结论、还不能得出什么结论。只用项目证据，不检索外部资料。"},"tool_name":"project_query_facts"}]},"reference_answer":"项目报告把 impact 记为 blocked，原因为 snapshots_not_comparable：现有两侧快照不具备可比较条件，因此不能从本次结果推出配置变更的影响范围。policy.TASK_REF 也为 blocked，原因为 ambiguous_target：当前引用不能唯一解析到目标，因此依赖该目标的检查不能继续。它们能证明的是 Workbench 在这两个明确边界处停止，并记录了上述状态/原因；不能证明具体根因、真实 ECU 行为、DaVinci 已运行，或某个 BSW package mismatch 已发生。下一步应先补齐唯一引用目标和可比较快照，再重新执行相应静态检查。","report":"output/p28-validation/installed-final/evidence/delivery/projects/ambiguous/bundle/project-report.json","report_sha256":"2b4e6bcd7f353bdfb8ebfccb7297674c1d5ab97b2ce618f7d4fcb1fb5e29eeb0"},{"bundle_sha256":"68134b833e26e93825a6cd7d8eaf4faf9446f3dfa3ccc609ffcc0071a3622ff2","case_id":"official-validation-explainer","category":"official-only-explainer","criteria":[{"criterion_id":"validation-scope","description":"包含一致性、完整性与 MICROSAR 规则符合性。"},{"criterion_id":"inputs-and-exit","description":"包含显式 project/BSW package、可选范围和 --fail-on 阈值。"},{"criterion_id":"no-run-claim","description":"缺少真实命令与输出时不声称项目通过或失败，并保留安装/许可边界。"}],"plan":{"artifact_type":"agent-evidence-plan","boundary":"The control plane selects a fixed sequence of registered read tools. The model cannot add, remove, reorder, or parameterize those calls.","goal":"向同事解释 dvcfg-b project validate 的官方资料范围：它检查什么、运行需要哪些输入、什么会影响非零退出；在没有真实命令和输出时应如何表述结论。只用已审核资料，不查询项目事实。","plan_id":"bd1e804dd4861404e70e4a82f0e2d1d9070a0952379df42294172e7c2c586203","schema_version":"agent-evidence-plan-0.1","scope":"reviewed_knowledge","steps":[{"arguments":{"question":"向同事解释 dvcfg-b project validate 的官方资料范围：它检查什么、运行需要哪些输入、什么会影响非零退出；在没有真实命令和输出时应如何表述结论。只用已审核资料，不查询项目事实。"},"tool_name":"knowledge_retrieve_reviewed"}]},"reference_answer":"已审核的 Vector 手册摘要说明，dvcfg-b project validate 用于检查 ECU 配置的一致性、完整性和 MICROSAR 规则符合性；运行时需要显式指定 DaVinci project 与 BSW package，可选择 module/external-step 范围，并由 --fail-on 设置触发非零退出的严重度阈值。若没有实际 project/package、完整参数、工具版本和命令输出，只能说明该命令的文档能力与所需条件，不能声称某个项目已经通过、失败，或该 Workbench 报告来自一次真实 DaVinci 校验。资料也不证明本机安装、许可或 SIP 兼容性。","report":"output/p28-validation/installed-final/evidence/delivery/projects/ambiguous/bundle/project-report.json","report_sha256":"2b4e6bcd7f353bdfb8ebfccb7297674c1d5ab97b2ce618f7d4fcb1fb5e29eeb0"},{"bundle_sha256":"68134b833e26e93825a6cd7d8eaf4faf9446f3dfa3ccc609ffcc0071a3622ff2","case_id":"causal-separation-note","category":"mixed-causal-separation","criteria":[{"criterion_id":"reject-causal-leap","description":"明确拒绝把现有两个 Workbench reason 直接等同于 package mismatch。"},{"criterion_id":"source-separation","description":"把项目记录与官方条件性行为分开表述。"},{"criterion_id":"minimal-evidence","description":"列出 package identity/version/path/dialog 与实际 validate 参数、版本、退出码和输出。"}],"plan":{"artifact_type":"agent-evidence-plan","boundary":"The control plane selects a fixed sequence of registered read tools. The model cannot add, remove, reorder, or parameterize those calls.","goal":"写一段因果判断：当前证据能否把两个 blocked 检查归因于 DaVinci BSW Package identity mismatch？同时列出支持或否定该归因所缺的最小证据，严格区分项目记录与官方资料。","plan_id":"d0f827e8e6722358d73f8c5666b32ac372e2d746d145e94d7bcb437b817572dd","schema_version":"agent-evidence-plan-0.1","scope":"project_and_reviewed_knowledge","steps":[{"arguments":{"question":"写一段因果判断：当前证据能否把两个 blocked 检查归因于 DaVinci BSW Package identity mismatch？同时列出支持或否定该归因所缺的最小证据，严格区分项目记录与官方资料。"},"tool_name":"project_query_facts"},{"arguments":{"question":"写一段因果判断：当前证据能否把两个 blocked 检查归因于 DaVinci BSW Package identity mismatch？同时列出支持或否定该归因所缺的最小证据，严格区分项目记录与官方资料。"},"tool_name":"knowledge_retrieve_reviewed"}]},"reference_answer":"不能据当前证据把两个 blocked 检查归因于 DaVinci BSW Package identity mismatch。项目记录给出的直接原因分别是 impact 的 snapshots_not_comparable 和 policy.TASK_REF 的 ambiguous_target；它没有记录 DaVinci package identity、delivery version、mismatch 对话框、installed package path 或真实命令输出。官方资料只说明：若 DaVinci project 记录的 BSW package identity 与已安装 package 不同，Configurator Classic 6 会停止并以只读方式打开项目；这提供一个条件性诊断假设，不是本项目根因证据。要支持该归因，至少需保存两侧 package identity/version、安装路径和 mismatch 提示；要判断 validate 结果，还需实际 project/package、命令参数、工具版本、退出码及输出。在这些证据出现前，应保持“未证实”。","report":"output/p28-validation/installed-final/evidence/delivery/projects/ambiguous/bundle/project-report.json","report_sha256":"2b4e6bcd7f353bdfb8ebfccb7297674c1d5ab97b2ce618f7d4fcb1fb5e29eeb0"},{"bundle_sha256":"68134b833e26e93825a6cd7d8eaf4faf9446f3dfa3ccc609ffcc0071a3622ff2","case_id":"readonly-triage-ticket","category":"mixed-readonly-triage","criteria":[{"criterion_id":"dependency-order","description":"顺序先唯一化 TASK_REF，再建立可比较快照，之后才核对 package mismatch 和运行 validate。"},{"criterion_id":"completion-conditions","description":"每一步都有可审计的完成条件或保存项。"},{"criterion_id":"recommendation-boundary","description":"明确区分已记录阻断与尚未执行的条件性建议。"}],"plan":{"artifact_type":"agent-evidence-plan","boundary":"The control plane selects a fixed sequence of registered read tools. The model cannot add, remove, reorder, or parameterize those calls.","goal":"把现有证据整理成只读排查工单，给出有先后依赖的步骤，以区分 ambiguous_target、snapshots_not_comparable 和可能的 DaVinci package mismatch；每一步注明完成条件，不能把建议写成已验证事实。","plan_id":"acc2604bbbaac9d75721efbbf3980c80a29cdd50793d4cd3ba3c032fa78b1c7a","schema_version":"agent-evidence-plan-0.1","scope":"project_and_reviewed_knowledge","steps":[{"arguments":{"question":"把现有证据整理成只读排查工单，给出有先后依赖的步骤，以区分 ambiguous_target、snapshots_not_comparable 和可能的 DaVinci package mismatch；每一步注明完成条件，不能把建议写成已验证事实。"},"tool_name":"project_query_facts"},{"arguments":{"question":"把现有证据整理成只读排查工单，给出有先后依赖的步骤，以区分 ambiguous_target、snapshots_not_comparable 和可能的 DaVinci package mismatch；每一步注明完成条件，不能把建议写成已验证事实。"},"tool_name":"knowledge_retrieve_reviewed"}]},"reference_answer":"建议按依赖顺序处理，并把以下内容视为待执行步骤而非既成事实。1）先处理 policy.TASK_REF：定位所有候选引用目标，建立唯一映射；完成条件是引用解析不再返回 ambiguous_target。2）再处理 impact：固定 baseline/candidate 的来源、版本和对象身份，使两侧快照满足同一比较契约；完成条件是比较入口不再返回 snapshots_not_comparable。3）只有在 DaVinci 实际出现只读或 mismatch 提示时，才核对 project 记录与 installed BSW package 的 identity、delivery version 和安装路径；完成条件是保存可审计的两侧身份与提示证据。4）若要验证 ECU 配置，再用显式 project/package 和固定 module/external-step、--fail-on 参数运行 dvcfg-b project validate，保存工具版本、命令、退出码和输出。前两项是当前 Workbench 已记录的阻断，后两项只是官方资料支持的条件性排查路径；现有证据不能证明它们已经发生或执行。","report":"output/p28-validation/installed-final/evidence/delivery/projects/ambiguous/bundle/project-report.json","report_sha256":"2b4e6bcd7f353bdfb8ebfccb7297674c1d5ab97b2ce618f7d4fcb1fb5e29eeb0"}],"comparison_id":"p30-agent-evidence-comparison-v1","formation":"Four new comparison prompts and their Codex reference answers were written after evidence-plan 0.1 was remote-accepted and before any qwen3.5:2b inference on this cohort. The underlying public ambiguous report and curated Vector summaries are reused to isolate answer completeness from tool-routing failures.","implementation_sha256":"cf95fe36956c0149f014bac7c49c64680c46cbc03c45a7fd00bae8d2acfd9671","knowledge_corpus":{"corpus_id":"87471de46243344588dc091344e804a17bb96c7f720e99ab2d10bc14cab46e85","path":"examples/knowledge/p30-vector-official-corpus.json","sha256":"acdb4a13d7b79f12fd4e8e847ed68b638df78583ff6d49e0d12b4d714d5aa37e"},"knowledge_policy":{"path":"examples/knowledge/p30-vector-official-policy.json","policy_id":"b2a213dad56251d4f948112c9016c80eea4c7cfa26ac5392502fa79290fdb7b8","sha256":"9d004afd3cf54aafb4aacc56558dfbf400a2c7219f77628be0a4fae1f9751021"},"manifest_id":"67d556349f3d60bd751081c70ef181993888b0247796b4790d8109a7e3f82cab","model":{"digest":"324d162be6ca5629ae4517c8710434d0bd2d665bc94dbad46e9af8fbf8a2f0df","name":"qwen3.5:2b"},"reference_author":"OpenAI Codex agent-authored pre-inference reference","reference_boundary":"These references are user-authorized, agent-authored expectations, not independent human gold. They may guide a transparent Codex/Qwen comparison but cannot close the independent-human usability or real-project applicability gates.","schema_version":"agent-evidence-comparison-manifest-0.1","spec_sha256":"9df4a787123805d0c335c0a37e0ffa83085bddc61b7785d82dc76f07e5268d7f"}
